{
  "schema_version": "github-secret-scanning/v1",
  "attested_at": "2026-04-21",
  "attested_by": "example-maintainer",
  "repository": "example-org/example-repo",
  "posture": {
    "secret_scanning_enabled": true,
    "push_protection_enabled": true,
    "validity_checks_enabled": true
  },
  "notes": "Synthetic secret scanning posture for fixture evaluation."
}
